No LSB modules are available.
Distributor ID:	Ubuntu
Description:	Ubuntu 18.04.2 LTS
Release:	18.04
Codename:	bionic
4.18.0-16-generic
# /etc/shells: valid login shells
/bin/sh
/bin/bash
/bin/rbash
/bin/dash
processor	: 0
vendor_id	: GenuineIntel
cpu family	: 6
model		: 142
model name	: Intel(R) Core(TM) i5-8250U CPU @ 1.60GHz
stepping	: 10
cpu MHz		: 1800.002
cache size	: 6144 KB
physical id	: 0
siblings	: 2
core id		: 0
cpu cores	: 2
apicid		: 0
initial apicid	: 0
fpu		: yes
fpu_exception	: yes
cpuid level	: 22
wp		: yes
flags		: fpu vme de pse tsc msr pae mce cx8 apic sep mtrr pge mca cmov pat pse36 clflush mmx fxsr sse sse2 ht syscall nx rdtscp lm constant_tsc rep_good nopl xtopology nonstop_tsc cpuid tsc_known_freq pni pclmulqdq ssse3 cx16 pcid sse4_1 sse4_2 x2apic movbe popcnt aes xsave avx rdrand hypervisor lahf_lm abm 3dnowprefetch invpcid_single pti fsgsbase avx2 invpcid rdseed clflushopt flush_l1d
bugs		: cpu_meltdown spectre_v1 spectre_v2 spec_store_bypass l1tf
bogomips	: 3600.00
clflush size	: 64
cache_alignment	: 64
address sizes	: 39 bits physical, 48 bits virtual
power management:

processor	: 1
vendor_id	: GenuineIntel
cpu family	: 6
model		: 142
model name	: Intel(R) Core(TM) i5-8250U CPU @ 1.60GHz
stepping	: 10
cpu MHz		: 1800.002
cache size	: 6144 KB
physical id	: 0
siblings	: 2
core id		: 1
cpu cores	: 2
apicid		: 1
initial apicid	: 1
fpu		: yes
fpu_exception	: yes
cpuid level	: 22
wp		: yes
flags		: fpu vme de pse tsc msr pae mce cx8 apic sep mtrr pge mca cmov pat pse36 clflush mmx fxsr sse sse2 ht syscall nx rdtscp lm constant_tsc rep_good nopl xtopology nonstop_tsc cpuid tsc_known_freq pni pclmulqdq ssse3 cx16 pcid sse4_1 sse4_2 x2apic movbe popcnt aes xsave avx rdrand hypervisor lahf_lm abm 3dnowprefetch invpcid_single pti fsgsbase avx2 invpcid rdseed clflushopt flush_l1d
bugs		: cpu_meltdown spectre_v1 spectre_v2 spec_store_bypass l1tf
bogomips	: 3600.00
clflush size	: 64
cache_alignment	: 64
address sizes	: 39 bits physical, 48 bits virtual
power management:

MemTotal:        2040928 kB
MemFree:          203984 kB
MemAvailable:     873732 kB
Buffers:           57272 kB
Cached:           732948 kB
SwapCached:            0 kB
Active:          1095712 kB
Inactive:         511256 kB
Active(anon):     817672 kB
Inactive(anon):    13848 kB
Active(file):     278040 kB
Inactive(file):   497408 kB
Unevictable:          16 kB
Mlocked:              16 kB
SwapTotal:        483800 kB
SwapFree:         483800 kB
Dirty:                 0 kB
Writeback:             0 kB
AnonPages:        816736 kB
Mapped:           227544 kB
Shmem:             14776 kB
Slab:              90676 kB
SReclaimable:      51304 kB
SUnreclaim:        39372 kB
KernelStack:        9040 kB
PageTables:        43344 kB
NFS_Unstable:          0 kB
Bounce:                0 kB
WritebackTmp:          0 kB
CommitLimit:     1504264 kB
Committed_AS:    4677800 kB
VmallocTotal:   34359738367 kB
VmallocUsed:           0 kB
VmallocChunk:          0 kB
HardwareCorrupted:     0 kB
AnonHugePages:         0 kB
ShmemHugePages:        0 kB
ShmemPmdMapped:        0 kB
CmaTotal:              0 kB
CmaFree:               0 kB
HugePages_Total:       0
HugePages_Free:        0
HugePages_Rsvd:        0
HugePages_Surp:        0
Hugepagesize:       2048 kB
Hugetlb:               0 kB
DirectMap4k:      131008 kB
DirectMap2M:     1966080 kB
[sudo] password for shabeerdas: 

/dev/sda:

ATA device, with non-removable media
	Model Number:       VBOX HARDDISK                           
	Serial Number:      VBf60e3d86-9d5286fd 
	Firmware Revision:  1.0     
Standards:
	Used: ATA/ATAPI-6 published, ANSI INCITS 361-2002 
	Supported: 6 5 4 
Configuration:
	Logical		max	current
	cylinders	16383	16383
	heads		16	16
	sectors/track	63	63
	--
	CHS current addressable sectors:    16514064
	LBA    user addressable sectors:    20971520
	LBA48  user addressable sectors:    20971520
	Logical/Physical Sector size:           512 bytes
	device size with M = 1024*1024:       10240 MBytes
	device size with M = 1000*1000:       10737 MBytes (10 GB)
	cache/buffer size  = 256 KBytes (type=DualPortCache)
Capabilities:
	LBA, IORDY(cannot be disabled)
	Queue depth: 32
	Standby timer values: spec'd by Vendor, no device specific minimum
	R/W multiple sector transfer: Max = 128	Current = 128
	DMA: mdma0 mdma1 mdma2 udma0 udma1 udma2 udma3 udma4 udma5 *udma6 
	     Cycle time: min=120ns recommended=120ns
	PIO: pio0 pio1 pio2 pio3 pio4 
	     Cycle time: no flow control=120ns  IORDY flow control=120ns
Commands/features:
	Enabled	Supported:
	   *	Power Management feature set
	   *	Write cache
	   *	Look-ahead
	   *	48-bit Address feature set
	   *	Mandatory FLUSH_CACHE
	   *	FLUSH_CACHE_EXT
	   *	Gen2 signaling speed (3.0Gb/s)
	   *	Native Command Queueing (NCQ)
Checksum: correct
L1d cache:           32K
L1i cache:           32K
L2 cache:            256K
L3 cache:            6144K
fsck from util-linux 2.31.1
e2fsck 1.44.1 (24-Mar-2018)
/dev/sda1 is mounted.
e2fsck: Cannot continue, aborting.


No LSB modules are available.
